"(Issued at 07.00 a.m. on 20 September 2024, for next 24 hours)"
"Sea areas around the Island"
"Condition of Rain:"
"Showers or thundershowers may occur at several places in the sea areas off the coast extending"
"from Colombo to Hambantota via Galle."
"Winds:"
"Winds will be Westerly or South-westerly in direction and wind speed will be (30-40) kmph."
"W
ind speed can increase up to 60 kmph at times in the sea areas off the coasts extending from"
"Matara to Pottuvil via Hambantota and from Kankasanthurai to Puttalam via Mannar."
"Wind  speed  can  increase  up  to  about  (45-50)  kmph  at  times  in  the  sea  areas  off  the  coasts"
"extending  from  Trincomalee  to  Kankasanthurai  and  from  Puttalam  to  Matara  via  Colombo  and"
"Galle."
"State of Sea:"
"The  sea  areas  off  the  coasts  extending  from  Matara  to  Pottuvil  via  Hambantota  and  from"
"Kankasanthurai to Puttalam via Mannar will be rough at times."
"T
he sea areas off the coasts extending from Trincomalee to Kankasanthurai and from Puttalam to"
"Matara via Colombo and Galle may be fairly rough at times."
"T
emporarily strong gusty winds and very rough seas can be expected during thundershowers."
